id,name,email,website,description,avatar_url,created_at,banner_image,featured_app
the-document-foundation,The Document Foundation,,https://www.documentfoundation.org,"Nonprofit organization behind LibreOffice, a free and open‑source office suite supporting global community development.

",https://media.licdn.com/dms/image/v2/C4D0BAQFwKCybjqeXhg/company-logo_200_200/company-logo_200_200/0/1630560903004/tdforg_logo?e=2147483647&v=beta&t=pI0oIdLP484W0Pv-er-W-njgI24XNMr5E9-mAVeg8JA,2026-01-14 03:05:10.841387+00,,
the-tor-project-inc,"The Tor Project, Inc.",,https://www.torproject.org,Nonprofit organization developing Tor Browser and related privacy tools to promote anonymous communication online.,https://www.torproject.org/static/images/tor-project-logo-onions.png,2026-01-14 03:10:54.491381+00,,
valve-corporation,Valve Corporation,,https://valvesoftware.com,"A pioneering force in entertainment software, Valve Corporation is the developer of acclaimed franchises like Half-Life, Portal, and Counter-Strike. Beyond game development, Valve operates Steam, the world’s premier digital distribution platform, and continues to redefine gaming through innovative hardware like the Steam Deck.",https://sm.ign.com/ign_in/news/d/deadlocks-/deadlocks-existence-finally-acknowledged-by-valve-with-a-sto_j565.png,2025-12-24 07:56:26.06938+00,https://www.designyourway.net/blog/wp-content/uploads/2023/12/Featured-1-25.jpg,
videolan,VideoLAN,videolan@videolan.org,https://www.videolan.org,"VideoLAN is a non-profit organization based in Paris, France, best known for creating VLC Media Player, one of the world’s most popular open-source multimedia applications. Founded in 2009, VideoLAN is driven by volunteers and developers worldwide, dedicated to promoting free software for video and audio playback, streaming, and multimedia solutions. Their flagship project, VLC, is renowned for its ability to play virtually any media format across platforms without additional codecs. VideoLAN continues to innovate in the field of multimedia, offering reliable, community-driven software that empowers millions of users globally.",https://i.ibb.co/20Nr8fPc/7ccb010d8fddc4bcd84587ef3c34d100.jpg,2025-12-24 10:24:19.544154+00,https://www.shutterstock.com/image-photo/digital-contents-concept-social-networking-260nw-2164090919.jpg,
whatsapp-llc,WhatsApp LLC,support@whatsapp.com,https://www.whatsapp.com,"US‑based company owned by Meta Platforms, developer of WhatsApp Messenger, one of the world’s most widely used messaging apps focused on speed, reliability, and end‑to‑end encryption.",https://static.vecteezy.com/system/resources/previews/023/986/631/non_2x/whatsapp-logo-whatsapp-logo-transparent-whatsapp-icon-transparent-free-free-png.png,2026-01-27 11:05:38.137771+00,,
win-rar-gmbh,win.rar GmbH,,https://www.rarlab.com,"German software company behind WinRAR, a widely used file compression and archiving utility for Windows.",https://5.imimg.com/data5/SELLER/Default/2022/1/XL/FA/FZ/77642205/winrar-software.png,2026-01-14 03:48:09.117058+00,,
xbox-game-studios,Xbox Game Studios,,https://www.xbox.com/,"Division of Microsoft responsible for developing and publishing video games across Xbox consoles, Windows PCs, and cloud gaming platforms.",https://avatars.akamai.steamstatic.com/160d7b7d4811951be05e64e821cc93698fccf310_full.jpg,2026-01-14 03:02:32.755621+00,,
xiaomi-inc,Xiaomi Inc.,,https://www.mi.com,"Chinese electronics company founded in 2010, developer of Mi smartphones, MIUI software, and a wide range of smart devices.",https://instantlogodesign.com/blog/wp-content/uploads/2022/04/Old-Xiaomi-logo-1.jpg,2026-01-14 03:11:52.289694+00,,
zdevs,ZDevs,,https://zdevs.com,"Independent developer group focused on mobile apps and utilities, offering lightweight tools and entertainment apps.",https://zdevs.ru/img/icon_zug.png,2026-01-27 11:10:51.572347+00,,
zoom-communications-inc,Zoom Communications Inc,,https://zoom.us,"US‑based company founded in 2011, developer of Zoom, a leading video conferencing and collaboration platform used worldwide.",https://img.freepik.com/premium-vector/zoom-video-communications-zoom-logo-application-video-communications-video-audio_944081-183.jpg,2026-01-14 03:12:21.693079+00,,